[
  {
    "id": "cassava_mosaic_disease",
    "cropId": "cassava",
    "category": "viral",
    "scientificName": {
      "fr": "Maladie de la mosaïque du manioc (CMD)",
      "en": "Cassava Mosaic Disease (CMD)"
    },
    "commonName": {
      "fr": "Mosaïque africaine du manioc",
      "en": "African Cassava Mosaic"
    },
    "affectedOrgans": {
      "fr": ["Feuilles", "Folioles", "Pousses"],
      "en": ["Leaves", "Leaflets", "Shoots"]
    },
    "earlySymptoms": {
      "fr": "Motifs irréguliers vert clair et vert foncé sur les feuilles jeunes, légère déformation des folioles.",
      "en": "Irregular light and dark green mosaic patterns on young leaves, slight leaflet distortion."
    },
    "advancedSymptoms": {
      "fr": "Mosaïque généralisée, réduction de la taille foliaire, nanisme, baisse drastique du rendement.",
      "en": "Generalized mosaic, reduced leaf size, stunting, severe yield loss."
    },
    "causalAgents": {
      "fr": "Begomovirus (Cassava mosaic begomoviruses), transmis par Bemisia tabaci.",
      "en": "Begomoviruses (Cassava mosaic begomoviruses), transmitted by Bemisia tabaci whiteflies."
    },
    "vectors": {
      "fr": "Mouches blanches (Bemisia tabaci).",
      "en": "Whiteflies (Bemisia tabaci)."
    },
    "favorableFactors": {
      "fr": "Plants infectés voisins, boutures contaminées, forte pression de mouches blanches, variétés sensibles.",
      "en": "Infected neighboring plants, contaminated cuttings, high whitefly pressure, susceptible varieties."
    },
    "climateConditions": {
      "fr": "Saison sèche avec températures chaudes favorisant les populations de mouches blanches.",
      "en": "Dry season with warm temperatures favoring whitefly populations."
    },
    "prevention": {
      "fr": [
        "Utiliser des boutures saines certifiées.",
        "Employer des variétés résistantes ou tolérantes.",
        "Assurer une bonne préparation et fertilisation du sol.",
        "Effectuer un sarclage régulier pour limiter les repousses infectées."
      ],
      "en": [
        "Use certified healthy cuttings.",
        "Plant resistant or tolerant varieties.",
        "Ensure proper soil preparation and fertilization.",
        "Regular weeding to remove infected regrowth."
      ]
    },
    "control": {
      "fr": [
        "Arracher et détruire les plants infectés.",
        "Éviter le déplacement de boutures d'une zone infestée à une autre.",
        "Surveiller et réduire les populations de mouches blanches si nécessaire."
      ],
      "en": [
        "Uproot and destroy infected plants.",
        "Avoid moving cuttings from infested to clean areas.",
        "Monitor and reduce whitefly populations when necessary."
      ]
    },
    "severityLevel": "critical",
    "photoPaths": ["Cultures/Cassava/01-VIROSES/MOSAIQUE AFRICAINE"],
    "references": [
      "Ouvrages/LeggandAlvarez-DiseasesAffectingCassava-2017.pdf",
      "Ouvrages/Field problems in cassava.pdf",
      "https://www.fao.org/agriculture/crops/thematic-sitemap/theme/pests/cassava-diseases/en/"
    ],
    "recommendedCaptureTargets": ["leaf", "leaflet"],
    "datasetFolder": "01-VIROSES/MOSAIQUE AFRICAINE",
    "mlClassId": 0
  },
  {
    "id": "cassava_brown_streak",
    "cropId": "cassava",
    "category": "viral",
    "scientificName": {
      "fr": "Striure brune du manioc (CBSD)",
      "en": "Cassava Brown Streak Disease (CBSD)"
    },
    "commonName": {
      "fr": "Striure brune",
      "en": "Brown streak"
    },
    "affectedOrgans": {
      "fr": ["Feuilles", "Tiges", "Racines", "Tubercules"],
      "en": ["Leaves", "Stems", "Roots", "Tubers"]
    },
    "earlySymptoms": {
      "fr": "Chlorose en V ou en Y sur les feuilles matures, légères taches brunes sur les tiges.",
      "en": "V- or Y-shaped chlorosis on mature leaves, slight brown streaks on stems."
    },
    "advancedSymptoms": {
      "fr": "Stries brunes sur tiges et racines, pourriture nécrotique des tubercules, perte de qualité amylacée.",
      "en": "Brown streaks on stems and roots, necrotic rot of tubers, loss of starch quality."
    },
    "causalAgents": {
      "fr": "Ipomovirus (Cassava brown streak virus), transmis par Bemisia tabaci et boutures infectées.",
      "en": "Ipomovirus (Cassava brown streak virus), transmitted by Bemisia tabaci and infected cuttings."
    },
    "vectors": {
      "fr": "Mouches blanches (Bemisia tabaci), boutures contaminées.",
      "en": "Whiteflies (Bemisia tabaci), contaminated cuttings."
    },
    "favorableFactors": {
      "fr": "Variétés sensibles, boutures infectées, sols pauvres, plantation tardive, pression de vecteurs.",
      "en": "Susceptible varieties, infected cuttings, poor soils, late planting, vector pressure."
    },
    "climateConditions": {
      "fr": "Zones humides et altitudes modérées à élevées où la maladie est historiquement répandue.",
      "en": "Humid zones and moderate to high altitudes where the disease is historically prevalent."
    },
    "prevention": {
      "fr": [
        "Utiliser uniquement des boutures provenant de plants sains.",
        "Préférer les variétés résistantes.",
        "Éviter les sols pauvres et planter précocement.",
        "Inspecter régulièrement les parcelles."
      ],
      "en": [
        "Use only cuttings from healthy plants.",
        "Prefer resistant varieties.",
        "Avoid poor soils and plant early.",
        "Inspect fields regularly."
      ]
    },
    "control": {
      "fr": [
        "Aucun pesticide n'est efficace contre les virus.",
        "Éliminer les plants malades dès les premiers symptômes.",
        "Ne pas replanter de boutures issues de plants suspects."
      ],
      "en": [
        "No pesticide is effective against viruses.",
        "Remove diseased plants at first symptoms.",
        "Do not replant cuttings from suspect plants."
      ]
    },
    "severityLevel": "critical",
    "photoPaths": ["Cultures/Cassava/01-VIROSES/STRITUIRE BRUNE"],
    "references": [
      "Ouvrages/LeggandAlvarez-DiseasesAffectingCassava-2017.pdf",
      "Ouvrages/Field problems in cassava.pdf"
    ],
    "recommendedCaptureTargets": ["leaf", "stem", "root"],
    "datasetFolder": "01-VIROSES/STRITUIRE BRUNE",
    "mlClassId": 1
  },
  {
    "id": "cassava_bacterial_blight",
    "cropId": "cassava",
    "category": "bacterial",
    "scientificName": {
      "fr": "Brûlure bactérienne du manioc (CBB)",
      "en": "Cassava Bacterial Blight (CBB)"
    },
    "commonName": {
      "fr": "Brûlure bactérienne",
      "en": "Bacterial blight"
    },
    "affectedOrgans": {
      "fr": ["Feuilles", "Folioles", "Tiges", "Petioles"],
      "en": ["Leaves", "Leaflets", "Stems", "Petioles"]
    },
    "earlySymptoms": {
      "fr": "Taches angulaires huileuses sur feuilles, wilting localisé, gouttelettes bactériennes au petit matin.",
      "en": "Angular oily leaf spots, localized wilting, bacterial droplets in early morning."
    },
    "advancedSymptoms": {
      "fr": "Flétrissement généralisé, chancres sur tiges, défoliation, nécrose des tissus vasculaires.",
      "en": "Generalized wilting, stem cankers, defoliation, vascular tissue necrosis."
    },
    "causalAgents": {
      "fr": "Xanthomonas axonopodis pv. manihotis.",
      "en": "Xanthomonas axonopodis pv. manihotis."
    },
    "vectors": {
      "fr": "Pluie, outils contaminés, boutures infectées, vent avec éclaboussures.",
      "en": "Rain splash, contaminated tools, infected cuttings, wind-driven splash."
    },
    "favorableFactors": {
      "fr": "Fortes pluies, humidité élevée, blessures mécaniques, plantation dense, variétés sensibles.",
      "en": "Heavy rains, high humidity, mechanical wounds, dense planting, susceptible varieties."
    },
    "climateConditions": {
      "fr": "Saison pluvieuse chaude avec forte humidité foliaire.",
      "en": "Warm rainy season with high leaf wetness."
    },
    "prevention": {
      "fr": [
        "Utiliser des boutures saines.",
        "Éviter les blessures lors des opérations culturales.",
        "Assurer une bonne aération entre plants.",
        "Rotation et assainissement des outils."
      ],
      "en": [
        "Use healthy cuttings.",
        "Avoid wounds during field operations.",
        "Ensure good plant spacing for airflow.",
        "Rotate crops and sanitize tools."
      ]
    },
    "control": {
      "fr": [
        "Arracher les plants très infectés.",
        "Limiter la circulation dans la parcelle humide.",
        "Appliquer des mesures phytosanitaires recommandées localement si disponibles."
      ],
      "en": [
        "Uproot severely infected plants.",
        "Limit field traffic when wet.",
        "Apply locally recommended phytosanitary measures when available."
      ]
    },
    "severityLevel": "high",
    "photoPaths": ["Cultures/Cassava/02-BACTERIOSES"],
    "references": [
      "Ouvrages/Disease-control-IPM-Guide-Cassava.pdf",
      "Ouvrages/Field problems in cassava.pdf"
    ],
    "recommendedCaptureTargets": ["leaf", "leaflet", "stem"],
    "datasetFolder": "02-BACTERIOSES",
    "mlClassId": 2
  },
  {
    "id": "anthracnose",
    "cropId": "cassava",
    "category": "fungal",
    "scientificName": {
      "fr": "Anthracnose du manioc",
      "en": "Cassava anthracnose"
    },
    "commonName": {
      "fr": "Anthracnose",
      "en": "Anthracnose"
    },
    "affectedOrgans": {
      "fr": ["Feuilles", "Tiges", "Pétioles"],
      "en": ["Leaves", "Stems", "Petioles"]
    },
    "earlySymptoms": {
      "fr": "Petites taches brunes ou noires sur feuilles et tiges, lésions circulaires avec marge foncée.",
      "en": "Small brown or black spots on leaves and stems, circular lesions with dark margins."
    },
    "advancedSymptoms": {
      "fr": "Chancres sur tiges, chute prématurée des feuilles, affaiblissement général du plant.",
      "en": "Stem cankers, premature leaf drop, general plant weakening."
    },
    "causalAgents": {